{
  "report_contract_version": "CONTRACT-V7-BUILDER-SCAFFOLD-VALIDATION-V1",
  "scope": "audit-only-builder-scaffold",
  "python_runtime": "CPython 3.9.6",
  "unit_tests": {
    "status": "PASS",
    "tests_run": 31,
    "failures": 0,
    "errors": 0,
    "skipped": 0
  },
  "live_prerequisite_preflight": {
    "status": "BLOCKED",
    "error_code": "E_UPSTREAM_PREREQUISITE",
    "snapshot_candidate_creation_authorized": false,
    "failed_check_ids": [
      "formal_post_113_validator_hash",
      "controlled_input_directory",
      "formal_post_hash:清单/论文PDF清单.csv",
      "formal_post_hash:清单/汇总统计.json",
      "formal_post_hash:scripts/collect_references.py",
      "formal_post_hash:清单/资料池受控输入/source-pool-input-ledger.json",
      "formal_post_hash:清单/资料池受控输入/frozen-legacy-pdf-manifest.csv",
      "independent_prerequisite_manifest",
      "promotion_record_raw",
      "windows_transcript:source_pool",
      "windows_transcript:chip_scope",
      "windows_transcript:research_data_subject_contract",
      "independent_prerequisite_approval"
    ]
  },
  "formal_write_count": 0,
  "snapshot_candidate_count": 0,
  "artifact_hashes": {
    "@content-set-excluding-validation-report": "02deb22a403865fefe19b4efb30d89ffd167b8177e873a8ac538f9c592fe43f4",
    "README.md": "79d5ab67963d87ef6343522189f5d27f96742b5d097bdef3b296e8a875e68e83",
    "fixtures/chip-dag-critical.json": "2108173ca703dabaf0584f04f32ed116159aadbd854394ea7f638752d914c304",
    "fixtures/contract-dag-critical.json": "339e4e591c5fe4e56fab43134d5be6d08c0c8b5129b9dc9b4dd6c9c77ef7f16d",
    "fixtures/semantic-path-oracles.json": "c3103d89bc970935eadb0dfc6cd74034df30c8c3a9905d6e196cc7549ba9e6dc",
    "run_live_preflight.py": "4011cf5a65e59a01936e9ed0888d68155953e6b5aa93b50d3260c9610c0d9050",
    "run_tests.py": "c53dfd512441fbaddbc6bcd3e5ac2ddcd1f0ab1c35a54875ddf8ae82602e0781",
    "schemas/artifact-approval.schema.json": "facd8e14d7c9464db013a74817535643c40c015a71ab39381add06f695de5351",
    "schemas/bootstrap-item.schema.json": "d64a6fe2b40a58df7f347977162c885de4077d4642dea079314f6435b453e314",
    "schemas/source-pool-prerequisite.schema.json": "528dc54da90ee0c90a2c383d5781abb6f055649cea8866ca11fbe04e14f744b0",
    "schemas/validation-report.schema.json": "c12caa35867edfad1ae5878bfd1513c904091a81b913035c1c6e96440a7e8ccb",
    "src/v7_builder/__init__.py": "b8cb980c7af44844538fafc2aa8f3751822c10abfd468f3b74f0dab7a32ab8de",
    "src/v7_builder/authorization.py": "32c7f88afcaab4838939f7ff6cf17cffabc3c0f6b23c18b1db7176a253ecc972",
    "src/v7_builder/bootstrap.py": "867bc0b925552a94e90364d0fa8f3d7f52d12dde022e89ae8d961c83b1e00a80",
    "src/v7_builder/canonical.py": "f479764bb36782842122b90a40da2334a206ce743883b96e1f01e225d12bccb4",
    "src/v7_builder/dag.py": "dc2e41f10681167be0f8f6d8165b194c455ea180f895d4fecbed70a9207ce74b",
    "src/v7_builder/errors.py": "30be9e7ca843a6d7ee3e6871a7aa47b13527c2e8c8b92e274e99841063153ece",
    "src/v7_builder/formula.py": "ee70fa0fc1186a011725eb711fb268865af4ad254cefde6bd283da63876e444e",
    "src/v7_builder/freeze_scope.py": "5fe7fb850857d5ebbe73270c468ce85f0919161b5c41e5eacb8c0999bfdbb7a9",
    "src/v7_builder/guard.py": "b965f6f4fdb0a544becf58cc526652d7c70eca939e97056718abf6546690cdcd",
    "src/v7_builder/mapping.py": "5eabab78732595a5865843960acfccfe0e6f123024f8932b600ee0169cac3d1d",
    "src/v7_builder/preflight.py": "ab28ebd0940bce0a6b34b959f3973f2de2455b977e299a1ecda3e25feddfbcc5",
    "tests/__init__.py": "7a681235e4ce527f3edf8fcf51f53bd70b06c8ac075d70ee1a4182a95e2e9db2",
    "tests/support.py": "c934597dc26caf1cffccd974faa74093eeddd4289f7205495e37284f8eb3568c",
    "tests/test_artifacts.py": "ce7c20c079ae990deafad27f89fd719c36bd587b858bd92aaa0c37669be932d9",
    "tests/test_authorization.py": "d2b369d1e1c05288110bdbd5d477cef2ff89ec955d45c10ef921263301d8ec75",
    "tests/test_bootstrap.py": "5196a852e896930271b0dc788b4c6e0f5bd0be6beebbe9a337fd4d2df61b850e",
    "tests/test_canonical.py": "60203224242892b50b47a358faf5a255927675dcd4ed7c7c18d3d4f73cf2bf06",
    "tests/test_dag.py": "984ad16289b8ae409d631fde20d71c32f97901d4446d24a1c8910bb3965bbb12",
    "tests/test_formula.py": "39fc7ebaca1855ada0488828634b8772f8703350e4dde8d5b518645f3f83cfff",
    "tests/test_freeze_scope.py": "4c230b045f8b8a637c9dd95445779651330050374d850092a7c0694e98c06d5f",
    "tests/test_mapping.py": "92a65e7fd97c9636c7a4406926aeb5dbbb5180e152fa567856aae2fe57bfce88",
    "tests/test_preflight.py": "4c8627a72bbd0ae43ff438758dab12032b1ff094b2862acd47af9f3ef8f45df2"
  },
  "remaining_not_implemented": [
    "source-pool-113 formal promotion and independent prerequisite production",
    "real 45/58/12 bootstrap bytes, stable artifacts, managed patches and approvals",
    "contract operation, payload, image, rollback and transaction materialization",
    "PowerShell 5.1, PowerShell 7 and Windows hard-gate runtime execution",
    "GA100 38-input chip package, apply/resume/no-op/rollback and formal data writes"
  ]
}
